,tweet,label
4482,a of today there are dedicated covid hospital across the country with a total of bed for covid patient mohfwindia drharshvardhan drhvoffice covid covid covid coronaupdates coronavirusindia coronavirusupdates coronavirus,real
4483,a covid positive temple priest in the city of jaipur spread coronavirus to people when he smoked his pipe,fake
4484,a minute viral video in which a woman claim india ha entered stage of covid she claim that her husband is employed with a major news channel and the information wa passed to him by some dr gyani who head the indian covid team and asks people to stock up on food medicine and baby food for one month she also caution people about the army being deployed to enforce a strict lockdown in the upcoming day,fake
4485,video show a huge crowd gathered in an american mall neglecting the social distancing during current pandemic,fake
4486,on diagnostics more than test are currently in evaluation and new evidence ha been generated around rapid antigen detection test that could be gamechanging drtedros covid,real
4487,today more than million case of covid have been reported to who and life have been lost drtedros,real
4488,bidensoetoro funneled illegal million through fauccis nih into china wuhan institute of viralogys coronavirus bioweapon program which congress expressly prohibited bidensooetoro from working on bidensoetoro ccp associate caused this present covid bioweapon disaster,fake
4489,president of the united state of america donald trump tested positive for covid,fake
4490,an image that claim that asymptomatic carrier of the novel coronavirus are immune do not spread the coronavirus and communicate antibody to other people,fake
4491,according to the cdc so far this year florida ha had death from covid and from pneumonia average pneumonia death in florida from for the same time period are probably just a coincidence yeah,fake
4492,our daily update is published state reported 740k test 56k case and death the number of test ha rebounded the last three day,real
4493,latest update from the ministry of health for the seventh day in a row there are no new case of covid to report in new zealand our total number of confirmed case remains at which is the number we report to the world health organization,real
4494,covid wiped out after 5g mast destroyed,fake
4495,news government coronavirus strategy enters the hope it all sort itself out phase,fake
4496,new case of covid 19nigeria lagos fct delta edo ogun katsina bayelsa river borno plateau ondo oyo kwara osun enugu nasarawa abia cross river kaduna ekiti confirmed discharged death,real
4497,people in northeast england will not be able to meet others outside their household from today,real
4498,standard weekend reporting and singleday caveat apply but death fell to the lowest level since april,real
4499,a video showing medical staff in turkey saluting citizen,fake
4500,check out what a huge difference it make in the number for the state and why we really need the last few state that dont report negative or report them incompletely to get on board,real
4501,in public health it s our job to support people through that sense of helplessness dr rachael zacks is a cdc disease detective whose work on the covid response helped fuel the discussion on how it spread read her story,real
4502,our daily update is published we ve now tracked million test up 257k from yesterday another huge testing day wa a clear inflection point note that we can only track test that a state report for detail see,real
4503,this high rate of daily recovery ha positioned india a the top country globally with maximum number of recovered case this ha also pushed the recovery rate to a high of more than,real
4504,the covid racial data tracker let you break down the number by race and ethnicity which is crucial for understanding whats happening with the pandemic in the u,real
4505,panel setup by the home ministry recommends private hospital in delhi to lower cost of isolation bed and treatment in intensive care unit delhi health minister satyendar jain s condition deteriorates a he s being treated for covid covid coronavirusfacts,fake
4506,we added guam the northern mariana island puerto rico samoa and the u virgin island today too,real
4507,a photo claiming that sarscov is an old virus known since,fake
4508,the trump administration ha had zero unfulfilled equipment and supply request from state governor,fake
4509,what a solid update by healthyfla to their covid data reporting thank you,real
4510,rt thehill just in rhode island governor issue stay at home order amid coronavirus pandemic ban gathering of over five people,real
4511,the number of confirmed case is no longer falling in any region of the country the northeast ha been flat for day the midwest is rising again,real
4512,an article circulating on facebook claim that microsoft cofounder bill gate said a covid vaccine could kill almost one million people citing an interview he gave,fake
4513,european patent b1 is a vaccine for the new coronavirus,fake
4514,corona virus very new deadly form of virus china is suffering may come to india immediately avoid any form of cold drink ice cream koolfee etc any type of preserved food milkshake rough ice ice cola milk sweet older then hour for atleast day from today,fake
4515,rt drharshvardhan covid testing ha touched million test per day which translates to test per million population daily much h,real
4516,blowing hot air through a hairdryer will cure coronavirus,fake
4517,tiktok ha been completely banned in the united state,fake
4518,california s arriving traveler monitoring for covid wa limited by poor quality of received traveler data high volume of traveler asymptomatic transmission read more about lesson learned in this cdcmmwr,real
4519,updated on may more than million case of covid have been reported in the u s state report case you can now find the number of case by age group,real
4520,staff at the isolation facility who had close contact during the period the woman were there will be stood down and tested footage from the period when the woman transited through custom and immigration at auckland airport is also being reviewed,real
4521,a facebook post claim the covid test is a dangerous test and that the nasal swab test can enter the brain and cause lasting damage,fake
4522,rt pibindia death per million population in india are a compared to the world average of death per million secretary mohfw,real
4523,parent today join cdc live q a from 2pm et to ask your question about the importance of staying up to date on essential childhood vaccine during the covid outbreak visit cdc s instagram story here,real
4524,coronavirus curfew new restriction on pub are bad for controlling the virus hospitality expert claim,real
4525,a message asking people to not get out of their home tonight from 10pm to next day 5am because the government ha made arrangement to spray medicine in the air in order to kill the novel coronavirus,fake
4526,indiafightscorona major highlight this week more than lakh patient have been recovered one of the highest in the world more than crore test conducted more than lakh test conducted in last week active case are 5th of total case secretary mohfwindia,real
4527,cristiano ronaldo will convert his hotel into coronavirus hospital,fake
4528,black cat in vietnam are being killed and consumed a a covid cure,fake
4529,unmasked chinese intelligence officer reveals truth that it a biologicalweapon china developed and wa to use to end hong kong protest but it backfired if it true world must come together to end biologicalweapons coronavirusoutbreak,fake
4530,news lockdown and social distancing isn t necessary if you are really horny insists professor neil ferguson,fake
4531,it the first night of the republican national convention here a roundup of recent claim from realdonaldtrump and other republican on covid the economy and more,fake
4532,rt mumbaiyb navi mumbai smt purnima pandeyji secured self and family increasing immunity during this period of corona by regular use o,fake
4533,a mental health crisis can emerge from this pandemic there are public health and policy measure that can help do some research so that you re knowledgeable not only for friend and family but for yourself if you find yourself feeling symptom,real
4534,those coronavirus patient whose stomach is ok should be given coronil vati those patient who have stomach problem should be given ghiya torus roti only and if stomach become ok then coronilvati allow me to speak to doctor casualty willbe low narendramodi,fake
4535,michigan gov gretchen whitmer ha just been stripped of her emergency coronavirus power by her state legislature,fake
4536,now the question arises where tax payer money disappeared what is the duty of government bureaucracts during covid pandemic xpressbengaluru drashwathcn csogok,fake
4537,the coronavirus vaccine is ready and work in hour picture,fake
4538,a map showing 5g antenna in italy with accompanying claim that they are related to the coronavirus pandemic,fake
4539,factor that favor noninvasive ventilation include stably high oxygen requirement normal mental status ward location of care and moderate to severe covid,real
4540,the number of test completed by laboratory yesterday wa that brings the total number of test completed to date to there will still be wide testing of people with cold or flulike symptom a part of our ongoing community testing for the virus,real
4541,cdcmmwr find step that help slow the spread of covid may also reduce flu if widely practiced report emphasizes flu vaccination remains the best protection against flu getting a flu vaccine is more important than ever during the covid pandemic,real
4542,a post with photo claiming that covid infected patient in italy are left in the street,fake
4543,a a black man my greatest risk of death is no longer covid it is the color of my skin said nmhheartdoc,real
4544,delhi health minister satyendar jain said that not a single one of the thousand in markaz wa found coronavirus positive,fake
4545,five new case of covid have been reported a follows in lagos in kwara in katsina a at pm 12th april there are confirmed case of covid reported in nigeria have been discharged with death there are state with confirmed case in nigeria,real
4546,indiafightscorona india test more than lakh sample each day two day in a row total test near a new peak of crore more than crore tested in past week staysafe indiawillwin,real
4547,this ha been put together by usa student to thank india for supply of hydroxychloroquin proud moment,fake
4548,covid 19nigeria update two new lab have been activated for covid testing at dna lab a private sector lab in kaduna unimaid teaching hospital maiduguri this brings the number of covid testing lab in nigeria to in progress sokoto port harcourt,real
4549,also tax on covid mask sanitizers a c house lpg cylinder brief these r fast usage good frm idlis dosas meal in star hotel can yield revenue think tank nitiaayog consider these special corona tax of on all good pmoindia nsitharaman,fake
4550,the most presidential of drug donaldtrump america coronavirus medical cure,fake
4551,dr stella immanuel say a cure ha been found for covid,fake
4552,follow live wetherspoons reveals it ha had coronavirus case in pub since reopening,real
4553,indiafightscorona india recovery rate ha soared past ensuring more and more covid patient are recovering to further build on this achievement state ut have exceeded this high national average,real
4554,author chen mingfang the daughterinlaw of renowned doctor and medical professor dong dacheng shared her own experience recovering from covid,fake
4555,ryanair to introduce covid priority queue on all flight,fake
4556,our daily update is published we ve now tracked a total of million test up 138k from yesterday note that we can only track test that a state report and not all state report all test for detail see,real
4557,for the record we compile current hospitalization for state and dc now there are variation in how state count their covid patient because these number measure strain on the hospital system we record both confirmed and suspected covid hospitalization,real
4558,twt 2abhi mohit arvindkejriwal msisodia icmrdelhi moayush mohfwindia discharge criterion for severe case will be based on clinical recovery patient tested negative once by rtpcr after the resolution of symptom,real
4559,arizona case are declining and although testing ha also fallen the state current hospitalization number are also down which is unequivocally good still the state s two highest death toll are saturday and today,real
4560,if colorado continues to stayathome hospital should not become overloaded however if distancing is relaxed there is a potential for over 54k hospitalization overwhelming the system by april learn more at,real
4561,factchecking the wv democratic party s tweet on covid transmission the latest from our politifact west virginia partnership with wvumediacollege appalachia,fake
4562,the latest cdc covidview report indicates that while covid 19like illness are starting to decline in the southeast south central and south west coast region they are still at higher level compared to march april,real
4563,these are the state that reported over new case,real
4564,some good state news washington testing capacity seems to be all right they had some data reporting problem but also it seemed a if testing wa legitimately down nearly 8k test reported though,real
4565,a post on legitfundcom claimed that nigerian vicepresident mr abubakar wa weeping at the loss of his son life,fake
4566,new case of coronavirus in madrid are linked to two university and a club,fake
4567,still were not always going to have perfect number and thats why we do our best to tell you about where each one came from right on the site the state document we use for data entry is what you see on the site,real
4568,people departing managed isolation must now return a negative test prior to being released they can refuse the test and we can require them to stay for another day,real
4569,maximum suppression of this virus is the optimal strategy professor devi sridhar explains why she belief herd immunity is not an appropriate way forward in tackling covid get more on the latest restriction,real
4570,arizona s update catch some reporting backlog a common tuesday data effect across many state the day average is often more useful to watch whats clear the state s surge ha swamped local testing capacity this week almost a quarter of test have come back positive,real
4571,indiafightscorona state ut account for of the death in the last hour due to covid maharashtra reported death followed by karnataka and uttar pradesh with and death respectively,real
4572,also important this is not a grade for the testing effort itself but rather for the comprehensiveness and regularity of their reporting the former is obviously more important but the latter ha major impact on public understanding of whats happening alexismadrigal,real
4573,a video showing row of black body bag sprawled on the floor wa taken from east avenue medical center eamc,fake
4574,for month the trump administration wa repeatedly warned about the threat covid posed to our nation they ignored the expert failed to take action and now american are paying the price,fake
4575,our daily update is published state reported 658k test 56k case and death the number of currently hospitalized covid patient continues to fall there are many data issue which we note in this thread,real
4576,we have active case of which are from the recent community outbreak are imported case in quarantine and case is under investigation there are people receiving hospital level care for covid are in auckland city hospital while are in middlemore hospital,real
4577,the uk ha reported new coronavirus case the highest daily total in four month there have only been two day since the pandemic began which have exceeded this total,real
4578,the reported death toll today is people thats in line with last week number again these number do not include probable death in new york city because new york state doesnt record them yet,real
4579,indiafightscorona early identification followed through with prompt isolation and effective treatment in hospital leading to falling percentage of active covid case in india,real
4580,they have been in selfisolation since that case wa notified the second is a person who ha travelled back from overseas so is an imported case today s case bring new zealand s combined total of confirmed and probable covid case to,real
4581,the new app to track infection in germany corona warnapp is using your personal data and contact on your smartphone in order to track and identify people,fake
4582,rt cdcemergency help prevent the spread of covid avoid close contact with people who are sick wash hand often for at least secon,real
4583,say democratic leader aren t wearing mask or social distancing in private,fake
4584,a tweet by pakistani journalist saadia afzaal claiming that china ha developed a covid vaccine,fake
4585,indiafightscorona there is an exponential increase in the test per million tpm population state ut are performing more test per million than the national average secretary mohfwindia staysafe indiawillwin icmrdelhi,real
4586,indiafightscorona plasma therapy ha been used for more than year now in some form or the other for various virus infection it is being used in covid whether it help or not is being studied for studying there ha to have randomized control trial dg icmrdelhi,real
4587,a student from pondicherry university ha found a home remedy for covid that ha been accepted by world health organization who,fake
4588,coronavirus testing kit heading to the uk found to be contaminated with covid london evening standard,fake
4589,they have maked progress in early covid they treated with cow dung and urine now they are inventing more procedure modi is all set to go mar,fake
4590,updated coronavirus clinical reference now includes evidence for increased risk of younger patient with obesity,real
4591,the number of covid death in ceará state brazil fell by after an operation by the federal police to investigate fraud with the death toll,fake
4592,the u now see close to coronavirus death a day via webmd,real
4593,man dying from coronavirus spends final day negotiating with health insurance provider coronavirus healthcare,fake
4594,goi ha made all effort of ramping up it testing facility on a sustained basis the network of covid testing lab consists of lab govt pvt regulation for covid treatment in private hospital is being done are specific for state ut,real
4595,rt cdcdirector protect yourself from covid callin prescription ahead of time and use drivethru window curbside service mailor,real
4596,this week the ncdcteam trained military personnel including medical lab engineering kitchen staff from state osun ogun ekiti ondo kwara edo oyo the exercise focused on demystifying covid strengthening surveillance case reporting ipc case management,real
4597,many covid treatment may be associated with adverse skin reaction and should be considered in a differential diagnosis new report say,real
4598,a at pm 29th march there are confirmed case death for a breakdown of case by state in real time please see currently lagos fct ogun enugu ekiti oyo edo bauchi osun river benue kaduna,real
4599,we now have active case are from the community outbreak and are imported case in quarantine people linked to the cluster have been moved to a quarantine facility including people who have tested positive and household contact,real
4600,rt mohfwindia indiafightscorona india occupies the top position in the world in term of total recovery more than lakh have rec,real
4601,indiafightscorona it is to the credit of the graded collaborative effort of the centre and state ut that widespread testing ha enabled more than 6lakh test daily for day in a row from lab in jan india now ha lab,real
4602,government stick 30bn covid bill to dáil fridge,fake
4603,we factchecked night of rnc trump action to prevent covid biden on school choice and defunding the police and no james madison did not sign the declaration of independence,fake
4604,tasuku honjo japan s nobel prizewinning immunologist say that the coronavirus is not natural did not come from bat and wa manufactured by china,fake
4605,there are people with covid in our hospital today in aucklandd city in middlemore in north shore and in waitkato people are on a ward and are in icu one each in middlemore and waikato hospital,real
4606,they re going to have vaccine i think relatively soon,fake
4607,if you have chronic lung disease or asthma you are at higher risk for getting seriously ill from coronavirus learn how you can take step to protect yourself and slow the spread at covid,real
4608,how did donald trump respond to the coronavirus pandemic review key moment and what trump said at those time factchecked,fake
4609,underlying condition like diabetes mean greater risk for getting or transmitting covid within the home find a cdc study learn more,real
4610,say the governor of michigan new york and nevada have issued order banning the prescription of hydroxychloroquine to patient with covid,fake
4611,quote dr denis mukwege a saying he resigned from the congolese coronavirus response team because he wa ordered to fabricate covid case and death number,fake
4612,perchbicester want to get the team together we have covidsafe meeting room and plenty of coworking space free wifi and coffee conveniently located off the m40 in bicester close to train road and bus link,fake
4613,indiafightscorona india covid death per million population is also amongst the lowest in the world india ha death per million population whereas world average stand at secretary mohfwindia staysafe indiawillwin icmrdelhi,real
4614,till date nanded district maharashtra ha reported covid case of which are active covid case you may refer to the following link for detail mohfwindia drharshvardhan drhvoffice mantralayaroom covid coronavirus,real
4615,robbiedocs brigcm stevenreaney colstee oxfordevcharger isabeloakeshott greyfoxp borisjohnson yet all the other mask have one thing in common a one way valve to let exhaled air out a they seal to you facd stopping the ingres of paint smoke bacteria etc yet your cloth mask doe none of these and is supposed to stop a virus lol give your head a good wobble mate,fake
4616,the uptick in completed test is encouraging but well need a few more day of growth before we can declare the plateau in u s testing to be over,real
4617,a worker at a coronavirus testing centre ha told sky news that they are working at only a fraction of capacity even a people complain they cannot get a test,real
4618,school administrator cdc ha provided benchmark to help you prepare plan and respond to covid monitor these frequently and adjust strategy to fit the changing level of covid in your community learn more,real
4619,the debate over coronavirus vaccine is in this week s medscape clinical trend,real
4620,ufc pres dana white said no one person and no one place could have anticipated the challenge that covid would bring president trump said the coronavirus snuck up on u adding that it is a very unforeseen thing expert disagreed rnc,fake
4621,for example here is the page for texas you can see on this page that texas reported new test result today after having only performed cumulative test prior to today,real
4622,senate gop proposing fiveyear shield from coronavirus lawsuit,fake
4623,dr uma kumar of aiims gave the interview a shown in the video on coronavirus,fake
4624,chaddystacksdfs karluskap no big deal just a picture recently taken in wuhan china the birth place of covid,fake
4625,president trump ha left planet earth donaldtrump space coronavirus,fake
4626,some state continue to have issue reporting hospitalization data we ll touch on those problem later on in this thread but in at least state more than people are hospitalized with covid,real
4627,pelosi wa in wuhan china day after the impeachment hoax failed,fake
4628,nebraska is still of only state not releasing any race or ethnicity information the others are north dakota ndgov dougburgum and nevada nvgovernment govsisolak,real
4629,shadow health secretary jonathan ashworth say if these restriction dont work then of course we would consider further restriction but add that this should not be necessary if we fix the testing regime read the latest,real
4630,a survey of covid positive patient found that more than half could not identify having contact with a person who had covid take step to protect yourself and slow the spread see cdcmmwr,real
4631,the post show dead body of covid patient lying in the lnjp hospital delhi india,fake
4632,rt cdcdirector remember to practice every day foodsafety during covid put away food that could spoil such a meat milk egg,real
4633,video of a muslim leader being accidentally shot dead during a celebratory firing after he recovered from covid in pakistan,fake
4634,what might happen to those who become longterm unemployed due to covid previous experience show that if youre out of work for more than yr it a fair call to say it reduces your chance of finding work again by qanda factcheck,fake
4635,two new case of covid have been confirmed in nigeria in lagos and in osun both case are returning traveller to nigeria in the last day a at am 25th march there are confirmed case of covid in nigeria have been discharged with death,real
4636,say a photo show the same exact people at two different beach in los angeles county and jacksonville fla,fake
4637,indiafightscorona india covid case per million population is amongst the lowest in the world which stand at for india and for the world secretary mohfwindia staysafe indiawillwin icmrdelhi,real
