,tweet,label
1606,we re half a year on from who sounding it highest alarm by declaring the covid outbreak a public health emergency of international concern at the time on january there were just case outside of china and no death drtedros,real
1607,four new case of covid have been reported in nigeria in osun and in ogun a at am 31st march there are confirmed case of covid reported in nigeria with death,real
1608,mantova hospital in italy test plasma treatment to heal covid patient the italian government ha sent the carabinieri to stop the experimentation it because of bill gate,fake
1609,india main opposition party congress general secretary priyanka gandhi arranged bus to take home the migrant stuck in the state of uttar pradesh,fake
1610,saleyhaahsan bendepear contact tracing is key a the pandemic continues to evolve were trying to keep pace thats why we added a 4th indicator contact tracing to keep track read more here,real
1611,indiafightscorona there is an exponential increase in the daily covid testing in the country over lakh test were done in the last hour secretary mohfwindia staysafe indiawillwin icmrdelhi,real
1612,by inhaling steam from boiling sea salt and orange peeling for minute can prevent coronavirus from entering the body,fake
1613,what make patient with schizophrenia so vulnerable to coronavirus via drjlieberman,real
1614,uk newspaper say maulana saad of tablighi jamaat donated r crore to pm relief fund against coronavirus,fake
1615,here the comparison between new york and the rest of the state and territory of the known life lost due to covid have come in new york,real
1616,over the next week even if you don t have symptom please have a test if you re in south or west auckland or if you have a greater health risk if you were to get covid test are free and there are more than testing site nationwide,real
1617,yesterday i watched a live stream of u pole competition and it wa made abundantly clear that pole athlete are not doing well during covid ive heard enough depressing music to last me for month,fake
1618,rt pibindia in japan out of test turn out to be positive which is among the highest in the world in india out of,real
1619,in italy the cure for coronavirus is finally found,fake
1620,barack obama is the first expresident to ever speak against his successor,fake
1621,we cannot solve problem of over year in week a we work hard to reduce risk covid infection to health care worker on the frontlines we need a fundamental change in our approach to infection prevention control in nigerian hospital chikwei at ptfcovid,real
1622,yesterday our lab processed test the total number of test completed is almost of which have been completed in the last week or so due to to the high level of testing there can be delay of up to hour in processing test,real
1623,clinical trial outcome of favipiravir in the management of mild to moderate covid join the webinar using the below link kenyaphysicians,fake
1624,a video show bat the main source of the coronavirus on many roof in hubei district,fake
1625,here your regional story le than of case were reported by state in the northeast,real
1626,our daily update is published we ve tracked a total of completed test up from yesterday thats 118k the largest number yet note we can only track test that a state report and not all state report all test for detail,real
1627,donald trump ha refused to take serious action to combat the covid crisis and a a result he got what he s always wanted the u s isolated from the rest of the world,fake
1628,there are three additional previously reported case now considered to have recovered from covid our total number of active case is of those are imported case in miq facility and are community case our total number of confirmed case of covid is,real
1629,day 2lockdown बहत छट छट स सवधनय coronavirus क जड स खतम करन क लए जरर ह coronaviruspandemic 21dayslockdown 21dayschallenge indiafightscorona socialdistance best example thejohnabraham johnabrahamclub,fake
1630,the average test per million per day have increased from in the second week of july to in the first week of september a per who advice country need to conduct test per day per million population for comprehensive surveillance for suspect case,real
1631,the day average for covid death dropped below over the weekend,real
1632,report outbreak of idiocy spreading time faster than coronavirus coronovirus,fake
1633,today the honourable minister fmohnigeria convened a live press briefing to update nigerian on the ongoing response to the covid outbreak in nigeria a at 26th march there have been case of covid recorded in nigeria have been discharged with death,real
1634,at midday today the alert level restriction on social gathering were eased group of up to people are now permitted this includes event at home and outside of home and gathering like religious service party wedding tangihanga and funeral,real
1635,we now have people reported a having recovered from covid an increase of on yesterday this is of all case today there are two people receiving hospital level care for covid one each in auckland and middlemore hospital neither are in icu,real
1636,pakistani doctor osama riazs last message for you while taking his last breath,fake
1637,when the covid outbreak broke out in china we immediately started building our laboratory capacity within month we have activated a total of lab across the country with at least one per geopolitical zone to bring testing closer to the people chikwei,real
1638,devastated stock broker with face in hand clearly not taking coronavirus precaution seriously coronavirus covid stockmarketcrash,fake
1639,woman committed suicide due to the coronavirus lockdown,fake
1640,our combined total of confirmed and probable case remains at the number of recovered case is unchanged at only one case remains active there are no additional death to report,real
1641,say president donald trump never downplayed the virus,fake
1642,new modelling ha reportedly shown london is only two or three day behind coronavirus hotspot in the north west and north east,real
1643,cover your cough covid spread through respiratory droplet when an infected person cough sneeze or talk additionally it can also be spread when someone is not showing symptom take everyday precaution to do your part to stop the spread,real
1644,people are starting to enter er with fungal lung infection from wearing mask,fake
1645,man visited albany n y day before dying from coronavirus,fake
1646,in a series of interview and ad businessman clive palmer said antimalaria drug hydroxychloroquine ha contributed to australia low death rate from covid we found that claim to be baseless new factcheck auspol coronavirusfacts,fake
1647,i am calling on every ceo in america to publicly commit now to not buying back their company stock over the course of the next year a worker face the physical and economic consequence of the coronavirus our corporate leader cannot cede responsibility for their employee,fake
1648,the steam will kill the virus in our nose and throat and eradicate the coronavirus,fake
1649,we are pleased to announce the inclusion of new genexpert lab in taraba state to the ncdc molecular laboratory network taraba state specialist hospital jalingo general hospital takum this brings the number of lab with covid testing capacity in our lab network to,real
1650,covid update we have new confirmed case are related to the community outbreak in auckland and are imported we now have active case in the community and from managed isolation our total number of confirmed case to date is,real
1651,rt cdctravel looking for covid risk in a certain destination check out cdc s covid travel recommendation for each country,real
1652,a viral video showcasing an emergency treatment of a covid patient in maharashtra an indian state the video is shared in the name of different city of maharashtra,fake
1653,on monday september cabinet will decide if alert level gathering limit can increase in auckland and whether the rest of the country can move to alert level,real
1654,there are currently people in managed isolation and quarantine our current effective capacity is this give u an excess capacity of,real
1655,hotel to remain closed in india till october,fake
1656,cardiac mri scan showed that up to of big athlete who tested positive for covid also had myocarditis,real
1657,other state seem to be having trouble with several showing substantial drop in current hospitalization but not posting hhs notice we re reporting their hospitalization figure a published and hope to see smoother data next week,real
1658,group of pupil should only be sent home if there ha been a positive test rather than someone just developing symptom pm say,real
1659,israeli doctor say it is dangerous to wear mask outside,fake
1660,disregard any message that you are a beneficiary of covid fund or your account ha been credited by ncdc also ncdc is not sending letter of employment will never request for payment in return for employment offer share verified information,real
1661,one person remains in auckland city hospital in a stable condition on a ward one significant cluster remains open our total number of confirmed case of covid is now which is the number we report to the world health organization,real
1662,limiting gathering is one way to slow the spread of covid but physical distancing can be hard find tip to support the health of your loved one and you during this challenging time,real
1663,rt depsechargan mask can help prevent the spread of covid when they are widely used in public when you wear a mask you can help pro,real
1664,rt mediawise in a precovid world when we traveled across the u s to give medium literacy training to teen teacher at the school wou,fake
1665,indiafightscorona follow simple handwashing step to prevent the spread of covid staysafe indiawillwin mohfwindia drharshvardhan ministrywcd prakashjavdekar ddnewslive airnewsalerts unicefindia pibindia via uninindia,real
1666,president trump claim the virus is under control and testing is available,fake
1667,why mouthwash could help fight covid along with bad breath,real
1668,type and type diabetes associated with much higher risk of inhospital death with covid,real
1669,airborne is the main way covid spread doh should update our guideline a well,fake
1670,a vaccine that cure covid in three hour will be released next sunday according to president donald trump roche ha already produced million of those vaccine,fake
1671,new case of covid 19nigeria lagos delta ondo fct edo oyo kaduna enugu katsina imo adamawa ogun osun abia river nasarawa bauchi niger kebbi ekiti plateau taraba confirmed discharged death,real
1672,news new mary trump book claim donald trump order intern to take his daily covid test,fake
1673,testing a covid drug will determine if an emergency use authorization come by late fall via webmd,real
1674,rt pibindia indiafightscorona recovered case are time the number of active case people have been recovered so fa,real
1675,news government urged to lift lockdown after it emerges ed sheeran is using the time to write a new album,fake
1676,resident of corona california want the city s name changed donaldtrump california coronavirus grafitti,fake
1677,qanon theorist have touted drinking an industrial bleach known a mm or miracle mineral solution a a miracle cure for covid per wikipedia crazy democrat say republican ad claiming he protects pedophile is aimed at qanon follower via yahoo,fake
1678,there is no one in new zealand receiving hospitallevel care for covid yesterday our laboratory completed test bringing the total number of test completed to date to,real
1679,coronavirus four more welsh county face local lockdown after worrying and rapid rise in infection,real
1680,coronavirus pm doe not want another lockdown but say second wave inevitable,real
1681,this week s covidview report early indication that level of covid illness while still low may be increasing slightly in part of the united state hospitalization rate and death are still trending down learn more,real
1682,yesterday test were processed which brings the total to test processed overall,real
1683,an country recommendation for managing acute ischemic stroke in covid,real
1684,in the midst of a pandemic the trump administration chose to expend effort to attempt to disestablish the mashpee wampanoag tribe s reservation istandwithmashpee and with all of indian country,fake
1685,in order to combat covid we need both a decisive public health response and a decisive economic response i ve laid out exactly what i would do if i were president during this crisis take a look,fake
1686,we are still in the process of connecting with people we have had people who will not be tested because of reason such a being a child being part off repositioning crew currently being overseas or they are refusing a test people have refused testing,real
1687,panic and fear might be limiting human reasoning and fueling hoax about coronavirus via factchecknet coronavirusfacts datoscoronavirus,fake
1688,bill gate and the vatican have a plan to depopulate the world with a coronavirus vaccine,fake
1689,lock down exit will bump up corona case to 40k present official report is also under doubt still we are not tested corona case like germany already v r equivalent to france on corona case but our health infrastructure not enough to save poor,fake
1690,so basically jokowis bet with avigan favipiravir might actually payback after promising result in treating covid patient,fake
1691,india newborn twin named corona and covid after virus,fake
1692,even with the uncertainty of testing in florida and elsewhere case nationwide have trended down for the past week death however continue to climb towards a day average of,real
1693,bill gate admits his covid vaccine might kill nearly million people,fake
1694,say the coronavirus cause sudden death syndrome,fake
1695,govrondesantis claimed i would do press event in may i would never be asked about coronavirus press conference transcript show his claim is false,fake
1696,walmart amazon kroger target and costco have not had any reported coronavirus case in the news,fake
1697,according to hmoindia unlock 3guidelines swimming pool are not permitted to be functional from however yoga institute gymnasium will be allowed to function from for which sop will be issued by mohfwindia covid covid unlock covidupdates,real
1698,rt imperialcollege our coronavirus vaccine team led by prof robin shattock roboskis have been given million by dhscgovuk to fast,real
1699,lemon bicarbonate a tea and green tea can treat and prevent coronavirus,fake
1700,pope francis covid crisis a chance to come out better via ajenglish,fake
1701,westvirginia ha a low infection growth rate each person is infecting le than one other person so the total number of case is shrinking the positive test rate is low suggesting widespread testing icu use is low suggesting a capacity to handle new covid infection,real
1702,germany ha sent china a bill of billion for damage caused to the economy due to coronavirus,fake
1703,a study proved that chloroquine is an effective treatment against coronaviruses,fake
1704,today we announced the stamp it out plan for responding to new case of covid in the community ongoing elimination continues to be our strategy for dealing with covid to keep new zealander safe there is no evidence of community transmission to date,real
1705,india record more than new covid case for the second consecutive day in a row delhi cm arvind kejriwal announces plasma bank in delhi to help critically ill coronavirus patient covid coronavirusfacts,fake
1706,we re working with vaccine manufacturer to provide all country that join the effort timely and equitable access to all vaccine licensed and approved this doesn t just pool risk it also mean that price will be kept a low a possible drtedros covid,real
1707,dr anthony fauci ha known for year that chloroquine and hydroxychloroquine will not only treat a current case of coronavirus but prevent future case,fake
1708,india azim premji donates over crore to charity currently this field work is spread across karnataka uttarakhand rajasthan chhattisgarh puducherry telangana and madhya pradesh along with some work in the northeastern state of india,fake
1709,wearing a mask can help slow the spread of covid cdc s dr paige armstrong show you how to correctly put on and take off your mask wearamask keep your distance and wash your hand to help slow the spread of covid learn more,real
1710,a woman is making covid mask out of her panty coronavirus ebay panty coronavirusmasks fleamarkets,fake
1711,a new cdcmmwr find many covid infection among healthcare worker appear to go undetected likely because many people infected with the virus that cause covid have mild or no symptom learn more,real
1712,a girl child who wa just born in a village in the state of rajasthan said immediately after the birth that to contain the coronavirus outbreak in india every person in the country should apply turmeric paste on the toenail on their right foot the baby died after saying this,fake
1713,indiafightscorona a on 22nd september india recovery rate stand at secretary mohfwindia staysafe indiawillwin covid icmrdelhi,real
1714,factchecking president trump abc town hall claim on coronavirus joe biden thread,fake
1715,president trump ban chinese fortune cooky in the white house donaldtrump china coronavirus missile,fake
1716,ready set go the race to create a covid vaccine is on,real
1717,an exclusive picture of the patient s throat infected with coronavirus covid showing the extent of inflammation and destruction that affected the throat and entrance to the lung which wa caused by the virus in the first day of the infection taste and severe shortness of breath,fake
1718,arizona is the first u s state to begin reporting serology test weve been anticipating this so on the backend were prepared to record these number we will publish the data a soon a we can work out the particular kink of how to do so,real
1719,alexharv covid 19crusher i know that chloroquine is used in case of malaria when hydroxychloroquine may not be effective injectable quinine is used when both cq hcq will not if it becomes cerebral malaria blood brain barrier,fake
1720,local woman designates herself a covid town prefect,fake
1721,rt cdcemergency contact tracing slows the spread of covid see these answer to frequently asked question about contact tracing,real
1722,our pm update is published the u ha now tested at least people up from yesterday total note that we can only track test that a state report and not all state report negative test for detail see,real
1723,a further people in england have died with coronavirus in hospital bringing the total to according to nh england follow live update a daily figure start to come in,real
1724,update covid emergency healthcare seeking behaviour drastically changed decreased emergency department attendance patient under and those living further away from hospital le likely to visit a e report,real
1725,important study from thelancet find that of people living with a covid patient get the disease from the patient patient appear to be more infectious during the presymptomatic period than during the symptomatic period contact tracing matter,real
1726,state reported death the day average fell to,real
1727,this is actual budget all package put forward in p is now shown in glittering corona lighting stage pmoindia nsitharaman hope it may reach d end user nitiaayog,fake
1728,this make it difficult to compare hospitalization rate across state which is yet another reason that summary statistic of hospitalization data is something that should not be attempted without extreme care and understanding of the caveat see,real
1729,new case of covid lagos fct ogun kaduna oyo bayelsa gombe kano delta imo river niger bauchi plateau kwara case of covid 19nigeria discharged death takeresponsibility,real
1730,coronavirus stick faster on men with shaved head,fake
1731,remanagarajan state decides testing rate of covid for pvt lab for reference max limit of r per test wa fixed it wa also advised they can do free testing or testing on subsidized rate in this hour of crisis,real
1732,a long message attributed to bill gate the microsoft billionaire encouraging people to reflect positively on their life during the coronavirus outbreak ha been shared in multiple country,fake
1733,indiafightscorona india report more than recovery for the 3rd successive day total recovered case close to lakh highest in the world india recovery rate cross the landmark of staysafe indiawillwin,real
1734,just over close contact had been identified most of whom are from two work place americold mt wellington and the dominion road branch of finance now just over of them had been contacted so far,real
1735,happening now cnns drsanjaygupta angieholan and alexmahadevan are on facebook live discussing covid misinformation and answering your question,fake
1736,today the honourable minister fmohnigeria convened a live press briefing to update nigerian on the ongoing response to the covid outbreak nigeria a at pm 27th march there have been case of covid recorded in nigeria have been discharged with death,real
1737,covid 19nigeria update measure for easing of lockdown phase curfew from 10pm to 4am restricted opening of religious centre funeral limited to people no use of latex glove for nonmedical purpose closed school bar gym cinema restaurant nightclub,real
1738,gregmilamsky ten of thousand of oregonian have been driven from their home hundred will find those home gone when they return u correspondent gregmilamsky s eyewitness piece on the u wildfire,real
1739,people died of covid on in france,fake
1740,whether cdc had scheduled announcement that all should wear mask for everyday life,fake
1741,yesterday our laboratory processed test bringing the total number of test completed to date to there were swab taken in managed isolation and quarantine facility yesterday,real
1742,indiafightscorona nearly of the new recovery came from these five state state ut are reporting recovery rate more than staysafe indiawillwin,real
1743,in itly they couldnt control the virus so the people of italy is saying goodbye to the worldoutside the majid of milan this is really heart breaking stand with italy,fake
1744,three new case of covid have been confirmed in nigeria a at 45am on the 22nd of march there are confirmed case of covid recorded in nigeria of the confirmed case have been discharged with no death,real
1745,modijipostponejeeneet modiji it is highly risky for u to give exam in such a critical condition of covid sop are not followed because there are too many student and staff we are requested plz postpone jee neet or other exam until the situation come to normal,fake
1746,we updated our timeline of donald trump s shifting response to the coronavirus share any trump moment you think belong,fake
1747,elisa granato died shortly after being administered a trial vaccine for covid,fake
1748,if you get sick remember antibiotic do not work on virus like those that cause cold or flu talk to your doctor about the best treatment and what you can do to keep yourself and others healthy,real
1749,eating alkaline food with a ph level above can kill the sarscov virus,fake
1750,triump advocate middle age bloodletting donaldtrump virus conspiracytheories dictatorship vaccine,fake
1751,sisi raised the number of coronavirus case in egypt in the hope of billion from the world bank,fake
1752,renowned cardiac surgeon dr devi shetty ha issued a list of suggestion to be followed for one year to protect oneself against coronavirus,fake
1753,indiafightscorona a new peak of lakh covid test were done in the last hour even with such a high level of testing the positivity ha remained low i e compared to the weekly national average i e,real
1754,rt factchecknet a sorrowful outburst from a longtime fan who see idol illinformed or uninterested in fact about the new coronavirus,fake
1755,candidate vaccine are currently part of covax with a further candidate under evaluation giving the initiative the largest most diverse covid vaccine portfolio in the world,real
1756,of coronavirus death in scotland are from care facility,fake
1757,you may have seen post on social medium suggesting the government is installing the covidsafe app by stealth on smartphones well thats not correct according to fact checker dont believe the misinformation on the internet read coronacheck instead,fake
1758,breaking italian doctor have died due to covid they died trying to save people life and in return sacrificed theirs my condolence to their family coronavirus coronaoutbreak covid 19italy covid 19ireland,fake
1759,new tip released for institute of higher education to help you prepare when student faculty staff or administrator get sick with covid close off area used by a sick person for cleaning disinfection and notify local health official more here,real
1760,the newsthump guide to place you can visit during the national lockdown,fake
1761,eight new case of covid have been reported in nigeria in fct in oyo in kaduna and in osun state a at pm 28th march there are confirmed case of covid reported in nigeria with death,real
1762,quote sen lindsey graham a saying president trump probably know more about medicine and specifically virus than any of the socalled scientist at the nih and cdc,fake
1763,saint patrick is back to banish covid this time he pissed,fake
1764,angry mob of woman in coronavirus lockdown storm michigan governor office michigan nail,fake
