,tweet,label
0,the cdc currently report death in general the discrepancy in death count between different source are small and explicable the death toll stand at roughly people today,real
1,state reported death a small rise from last tuesday southern state reported of those death,real
2,politically correct woman almost u pandemic a excuse not to reuse plastic bag coronavirus nashville,fake
3,indiafightscorona we have covid testing laboratory in india and a on 25th august test have been done profbhargava dg icmrdelhi staysafe indiawillwin,real
4,populous state can generate large case count but if you look at the new case per million today smaller state are showing more case per million than california or texas al ar id k ky la m nv and sc,real
5,covid act now found on average each person in illinois with covid is infecting other people data show that the infection growth rate ha declined over time this factor in the stayathome order and other restriction put in place,real
6,if you tested positive for covid and have no symptom stay home and away from other people learn more about cdc s recommendation about when you can be around others after covid infection,real
7,obama call trump s coronavirus response a chaotic disaster,fake
8,clearly the obama administration did not leave any kind of game plan for something like this,fake
9,retraction hydroxychloroquine or chloroquine with or without a macrolide for treatment of covid a multinational registry analysis the lancet,fake
10,take simple daily precaution to help prevent the spread of respiratory illness like covid learn how to protect yourself from coronavirus covid,real
11,the nba is poised to restart this month in march we reported on how the utah jazz got coronavirus test in a matter of hour at a time when u s testing wa sluggish,fake
12,we just announced that the first participant in each age cohort have been dosed in the phase study of our mrna vaccine mrna against novel coronavirus read more mrna,real
13,coronavirusupdates indiafightscorona more than lakh test done for 3rd successive day cumulative testing a on date ha reached covid test per million tpm cross,real
14,protect yourself and others from covid when using public transportation practice social distancing avoid touching surface and practice hand hygiene learn more,real
15,a of august 8am till now there have been a total of covid positive case covid related death in manipur covid covid covid 19india covidupdates coronaupdates corona coronavirus coronavirusindia coronavirusupdates coronaviruspandemic,real
16,because of donald trump negligence and incompetence more than people have died we have nearly million case of covid over million american are out of work and yet he s patting himself on the back unbelievable,fake
17,indiafightscorona india continues to scale new peak in covid test more than lakh sample tested daily for consecutive day no other country ha achieved these level of very high daily testing pmoindia drharshvardhan ashwinikchoubey pibindia ddnewslive,real
18,we just announced that we have shipped vial of mrna the company s vaccine against the novel coronavirus to the nih to be used in the planned phase study in the u s,real
19,multiple facebook post claim that aussie will be fined if they are found to be talking about conspiracy to do with covid the post included a screenshot of a segment from an australian breakfast television show a evidence for the claim,fake
20,no nobel prize laureate tasuku honjo didnt say the coronavirus is not natural a a post on facebook claim in fact professor honjo said he greatly saddened his name wa used to spread misinformation this and more in the latest coronacheck,fake
21,the nz covid tracker app will remain important and useful at alert level people are encouraged to download the app or a similar one or keep a record of where you re going to be,real
22,breaking news the president cryill ramaphosa ha asked all foreign nation to depart south africa before june due to increasing case of covid,fake
23,we are delighted that high and uppermiddle country and economy have now confirmed they will participate in the covax facility and the number is growing i urge those who have not yet joined to do so by the 18th of september drtedros covid,real
24,very intriguing possibility that mood change and anxiety may be a function of invasion of the coronavirus into the cns and brain,real
25,elon musck to new baby get a job kid christmas covid elonmusk achristmascarol,fake
26,a new alcoholfree sanitizer ha been developed by the dedan kimathi university in kenya,fake
27,just appendix b gathering all the state order on testing wa a huge chunk of work same go for appendix d an evaluation of the accessibility of the cdc data tracker,real
28,yesterday our laboratory completed test of those were testing of people in managed isolation and quarantine for the routine testing on either day or of their stay that brings the total number of test completed to date to,real
29,reusing n95 mask nih found vaporized hydrogen peroxide uv light and heat to be effective sanitizers coronavirus,real
30,realdonaldtrump ha shifted his focus at different moment in the coronavirusoutbreak we updated our running timeline of his response to the virus reply to u with any recent trump moment you think belong on this running list,fake
31,doctored image of president donald trump shared claiming he asked people to chant hare krishna hare rama,fake
32,this fourthofjuly weekend if you choose to spend time outdoors at an event or gathering stay ft apart wear a cloth face cover to slow the spread of covid learn more at,real
33,cdc recommends mother stop breastfeeding to boost vaccine efficacy,fake
34,singapore airline haults all flight due to coronavirus outbreak,fake
35,florida governor ron desantis botch covid response by banning corona beer in order to flatten pandemic curve,fake
36,we apologise to the government of ekiti state for this error we remain committed to improving our quality control process to ensure accurate and transparent reporting of case,real
37,nyt invented the video of a doctor fighting coronavirus in hospital,fake
38,in may we did not break 30k case in a day today the south alone reported,real
39,alert american with coronavirus symptom are being asked to cough directly onto president trump,fake
40,we launched the covid solidarity response fund which ha so far mobilized m from more than individual company philanthropy in addition we mobilized billion from member state other generous to support country drtedros,real
41,football player cristiano ronaldo turned all his hotel into hospital to help coronavirus patient and is paying doctor and the staff,fake
42,including that there will again be testing of asymptomatic worker involved in managed isolation and quarantine and airport and border staff this is part of our wider surveillance measure and is expected to be operational in early july,real
43,i dont want to do a national lockdown again if coronavirus continues to progress in the uk the pm say the govt will have to take further measure but insists that he doesnt want a second national lockdown read more here,real
44,our daily update is published state reported 586k test 28k case and death,real
45,indiafightscorona new recovery in india have exceeded the new case for consecutive day covid,real
46,the top state with high active caseload are also the one which are presently reporting a high level of recovery,real
47,there are currently people in managed isolation and quarantine our current effective capacity is this give u an excess capacity of over the next week we are projecting arrival and departure from our facility,real
48,school are struggling to cope with a lack of covid test with new infection increasing since it became compulsory for pupil to return but when should you get your child tested for the virus here our explainer,real
49,scientist at astrazeneca complain their work on a coronavirus vaccine keep being delayed by noddy holder ringing up to ask if it will be ready by christmas,fake
50,mask can help prevent the spread of covid when they are widely used in public when you wear a mask you can help protect those around you when others wear one they can help protect people around them incl you wearamask doyourpart worldmaskweek,real
51,new case of covid 19nigeria lagos gombe plateau kwara enugu ogun katsina ekiti bauchi osun river confirmed discharged death,real
52,did you already have coronavirus here s a simple test,fake
53,rt mohfwindia indiafightscorona with high number of sustained recovery india surge ahead with highest single day recovery nearl,real
54,italy ha surrendered to the coronavirus pandemic a all the measure to control covid have been exhausted,fake
55,president trump ha been forced to wear a protective medical mask donaldtrump coronavirus cia fbi iud,fake
56,rt ellencutch coronavirus misinformation is moving offline a reddit user posted this flyer to the site and told u it had been delive,fake
57,orwell not dead but living under a bridge continued government toiletpaper georgeorwell coronavirus,fake
58,resident of york are asked what they think of a new government rule which allows people in england who may have covid to be fined up to if they fail to selfisolate to read more click here,real
59,central government ha given permission for school to reopen,fake
60,a of today there are a total of icmrdelhi approved lab for covid testing these consist of govt pvt lab covidtesting covid covid covid covid covid 19india covidupdates coronavirus coronaupdates coronavirusindia,real
61,the government ha come under pressure over a lack of availability of covid test read more here,real
62,fewer kid are dying since the lockdown a new white paper examines why,fake
63,more than million case of covid have now been reported to who and almost death although all country have been affected we continue to see intense transmission in a relatively small group of country drtedros,real
64,george soros is one of the people responsible for the new coronavirus born in a laboratory,fake
65,johnkin the sensitivity of the test is definitely something specialist are talking about i have not seen a real number but i also haven t looked that hard because we ve been doing other thing alexismadrigal,real
66,expert call out claim that cow dung urine yoga ayush can prevent or treat covid,fake
67,the main mode of transmission of novel coronavirus is through droplet and it is possible that infected smoker may blow droplet carrying the virus when they exhale regardless of covid you should steer clear of secondhand smoke a it may cause various health problem,real
68,an article claiming that bill gate vaccine would modify human dna,fake
69,rt surgeongeneral dyk handwashing remains one of the best way to prevent the spread of virus like covid here are thing to,real
70,according to the state health department haryana covid recoveryrate in gurugram is covid covid covid coronaupdates coronavirusindia coronavirusupdates coronavirus covidupdates,real
71,our daily update is published sunday and monday are when we tend to see the number dip and we see that today still 62k case rising hospitalization and a large jump in death over last sunday s holiday number the day average is now back over,real
72,our total number of confirmed case of covid is now which is the number we report to the world health organization,real
73,brazailian parliament went to a hospital that should take in covid patient and found it wa empty,fake
74,multiple post shared thousand of time on facebook twitter and youtube claim that salt is an effective remedy against the novel coronavirus,fake
75,un secretarygeneral antonio guterres say the covid pandemic ha dramatically derailed sustainable development goal and ha put into question progress that wa being made on the eradication of poverty and hunger latest world news,real
76,an instagram post is claiming covid test tainted with coronavirus have been in circulation for many month,fake
77,across the state who report them we tracked hospitalization the bulk in new york but louisiana and florida also have growing number of hospitalization,real
78,philippine senator grace poe and risa hontiveros have been silent over the coronavirus crisis but were very vocal about the closure of abscbn,fake
79,indiafightscorona india s total recovery continue to rise cross lakh today state contribute of total case of active case and of total fatality reported in india staysafe indiawillwin,real
80,the most important consequence of seeing covid a a syndemic is to underline it social origin the vulnerability of older citizen black asian and minority ethnic community and key worker who are commonly poorly paid with fewer welfare protection,fake
81,rt covidnewsbymib indiafightscorona icmrdelhi scale up covid testing capacity to lakh test per day in country a of now tota,real
82,a video show an italian doctor who say that nobody died from coronavirus in italy that it not more dangerous than a flu,fake
83,seasonal influenza vaccination will be mandatory in georgia this fall covid mortality rate are significantly lower than the fatality caused by other virus,fake
84,we can now say there are case in the mt roskill evangelical fellowship group and case in the bereavement subcluster which includes the case whose source of infection wa the bereavement event,real
85,there is no one in new zealand receiving hospitallevel care for covid yesterday our laboratory completed test bringing the total number of test completed to date to covid covid 19nz covid,real
86,a at pm 19th april the breakdown of case by state is lagos fct kano osun oyo edo ogun kwara katsina bauchi kaduna akwa ibom delta ekiti ondo enugu river niger benue anambra borno jigawa,real
87,the biggest change in the data is in the number of covid patient who are currently hospitalized with the addition of florida 7k hospitalization we re now over we have not seen those number since the first week of may and they do not seem likely to decline soon,real
88,coronavirusupdates covid india tracker a on september am confirmed case recovered active case death indiafightscorona indiawillwin staysafe via mohfwindia,real
89,there is a person with coronavirus in galicia on,fake
90,india ha now tested more than lakh sample day for covid this ha been enabled by icmrdelhi s commitment to set up over laboratory and expanding testing mechanism for detail visit icmrfightscovid indiafightscorona mohfwindia,real
91,claim that the jordanian health minister say covid is a conspiracy in a video,fake
92,pregnant woman with covid have a higher rate of premature birth,real
93,who solidarity trial are also underway in many country once these project are complete controlling covid effectively will be easier due to the availability of proper medicine vaccine etc a did to control various infectious disease across the world,real
94,covid update there are no new case of covid to report in new zealand today it ha been day since the last case of covid wa acquired locally from an unknown source,real
95,compare the number of completed test reported by new mexico a state with a population time smaller than california s these number should not even be close and yet they are,real
96,all case in the community are auckland based all are connected to the existing outbreak a close contact of case already reported of the new case are household contact of a previously reported case that is still under investigation the gp from mt wellington,real
97,a precautionary message that one can catch fire due to hand sanitizer a it ha a high amount of alcohol the message also show the hand of a lady who after applying sanitizer went near the stove and ended up burning her hand,fake
98,that brings new zealand s total number of active case to all are in managed isolation or quarantine facility there are no case in the community nzs total number of confirmed case of covid is now which is the number we report to the who,real
99,say rudy giuliani bought 2m in share of novartis a primary supplier of hydroxychloroquine in early february,fake
100,a student from pondicherry university in india ha found a home remedy for covid that ha been accepted by world health organization who,fake
101,footballer ronaldo is turning his hotel into covid hospital,fake
102,coronavirusupdates india record highest ever single day peak of covid recovery indiafightscorona a total recovery cross lakh recovery exceed the active case by more than lakh,real
103,do you have a cough fever or runny nose if these symptom came on suddenly there s a good chance you could have flu watch to find out what you should do next to fightflu,real
104,president trump say panda are responsible for covid donaldtrump china coronavirus zoo panda,fake
105,a of today there are active covid case in mumbai district maharastra mohfwindia drharshvardhan drhvoffice mantralayaroom covid covid covid coronaupdatesinindia coronavirus coronavirusupdates coronaviruspandemic,real
106,public health england weekly coronavirus report show a rise of almost in rhinovirus infection which include the common cold in the last week,real
107,this is an image of a suspected coronavirus vaccine causing covid,fake
108,some people are more likely than others to become severely ill from covid which mean that they may require hospitalization intensive care or a ventilator to help them breathe some severely ill people may die learn more,real
109,camila pitanga brazilian actress contracted covid but said she caught malaria so she could take chloroquine without admitting she wa wrong,fake
110,the new coronavirus cause sudden death syndrome,fake
111,indiafightscorona increasing gap between covid recovered active case of india may to september staysafe indiawillwin,real
112,cabinet office minister michael gove say there going to be a shift of emphasis on working from home in the new covid restriction kayburley get the latest coronavirus news,real
113,jamesgross well they are now reporting quite effectively it just they refuse to put their number in a table or dashboard for reason that are beyond me,real
114,looking at the number this is not like yesterday where one state california drove a huge increase this number seems much more solid driven by a number of state reporting large number of test completed,real
115,india ha lost over individual to coronavirus till date in view of the rising coronavirus case bihar government extends lockdown in the state till september at nationalist congress party chief sharad pawar s residence four people tested positive for coronavirus,fake
116,bill gate profit from vaccination and want to reduce the world population,fake
117,indiafightscorona mohfwindia held a virtual meeting today with state ut to ensure adequate oxygen availability in all healthcare facility unrestricted intra a well a inter state movement of oxygen read detail staysafe indiawillwin,real
118,hcps attend the next coca call tuesday aug at 2pm et via zoom topic covid telehealth implementation story from the field learn more covid,real
119,how a healthy yearold boy lost his life to covid in just day,real
120,an important part of our work is data collection and analysis at 30pm every day our data team collates result received from all testing laboratory to inform nigerian of the number of new covid case result not received at this time are reported the next day,real
121,finally we launched the first real version of the covid racial data tracker in partnership with dribram and the antiracismctr this ha been a major effort by our project volunteer and we hope it will be useful to community across the country,real
122,acc to mohfwindia incubation period for covid which is the time between exposure to the novel coronavirus becoming infected and symptom onset is to day with median estimate of to day but can be a long a day coronavirus covid covid,real
123,nasal flu vaccine side effect do not cause covid,fake
124,today s case bring our combined total of confirmed and probable covid case to we now have people reported a having recovered today there are two people in hospital one each in middlemore and north shore hospital neither are in icu,real
125,new publication covid pandemic could cause hiv treatment interruption and allow an increase in new infection program should plan now to avoid these risk and save life full report author brittajewell jennifersmith timothyhallett,real
126,transparency from our leader is vital during this crisis we must all have access to data so that we can make informed decision about our own behavior change az resident you can access our data model projection at,real
127,there is no one in nz receiving hospital level care for covid yesterday our laboratory completed test bringing the total number of test completed to the minister is advised reassured that these number will continue to increase over the coming day,real
128,in followlasg our rapid response team is working with nfeltp to strengthen community testing for covid in lgas the team provides support to newly reactivated lga walkin testing site for increased testing capacity access and awareness of covid at the grassroot level,real
129,of the new recovered case about are reported from five state viz maharashtra tamil nadu andhra pradesh karnataka uttar pradesh maharashtra ha alone contributed more than andhra pradesh ha contributed more than to the new recovery,real
130,claim india began screening passenger from covid 19affected country before it had a single case pm modi fact the govt mandated universal screening of all internatl flight only on march by when case had been detected across indian state,fake
131,say the coronavirus is a military bioweapon developed by china army,fake
132,in indore india police and doctor are injecting coronavirus positive blood in muslim,fake
133,photo of a vaccine developed by u s scientist for covid,fake
134,a video clip show a doctor couple who died after treating covid patient,fake
135,death were reported bringing the total in our dataset to this doe not include probable covid death reported by nyc but not by new york state were working on separate accounting of labconfirmed and probable death for all state where we can do so,real
136,youth sport organization a you resume activity have you planned what to do if a player visitor or coach get sick with covid cdc offer tip to protect the health and safety of staff player and visitor involved in youth sport tip here,real
137,not one politician ha died from the virus,fake
138,indiafightscorona health ministry review covid management response in district across state exhibiting high caseload and fatality,real
139,leaked report say there are too many human on the planet globalwarming coronavirus conspiracy,fake
140,another current known data problem is washington state after rocksolid reporting through the early part of the outbreak their system got gummed up and we have not seen a new update from the state for day,real
141,india spraying pesticide at night to prevent covid,fake
142,home ministry ha declared that posting on coronavirus ha been declared a punishable offense,fake
143,if you refuse to socialdistance you should sign a pledge to bypass care if you get ill with coronavirus via arthurcaplan,real
144,rt cdcenvironment do not use bleach solution or other disinfecting product on food currently no case of covid have been identifie,real
145,free coronavirus test kit available to all health coronavirus,fake
146,drharshvardhan dispels doubt raised over failure of one vaccine in clinical trial say trial are continuing only after expert committee reappraisal no significant mutation in sarscov in india icmr is actively exploring salivabased test for covid pibindia,real
147,thirtynine gps and specialist have written to the bmj calling for action on long covid,real
148,scientist are expressing cautious optimism that a covid vaccine can be ready to go by the late spring of although it s unclear how much longer it would take to distribute the vaccine widely,fake
149,if you want more context about the hospitalization data situation check out our weekly roundup in which we tackled this transitional period and how it producing erratic artificially deflated hospitalization data,real
150,coronavirusupdates covid testing status update icmrdelhi stated that sample tested upto september sample tested on september staysafe indiawillwin,real
151,video show the first infected patient of covid at dhanbad hospital,fake
152,a of today there are a total of active covid case in india and sample were tested today till 6pm for covid lakshadweep ha not reported a single case till date arunachalpradesh mizoram have not reported any covid case in the last 24hrs,real
153,trump and coronavirus may end november 3rd dranthonyfauci smallpox,fake
154,coronavirus this is how scientist believe coronavirus affect the body,fake
155,former rep trey gowdy wrote essay past on social medium claiming the covid pandemic wa planned to help democrat in the election,fake
156,health equity is when everyone ha the opportunity to be a healthy a possible we must address longstanding inequity that put some racial and ethnic group at a higher risk for covid learn about cdc s covid healthequity strategy,real
157,product page on amazon are offering toxic chlorine dioxide an industrial bleach often sold under the name miracle mineral solution a a covid cure reported by edpilkington in the guardian,fake
158,the most recent date that we have confirmed data for north carolina is may 16th the infection rate wa meaning that covid case were slowly increasing,real
159,it possible that some vaccine could be available at the end of the year csa patrick vallance say a vaccine could be available in small amount for certain group adding that were more likely to see vaccine over the first half of next year,real
