,tweet,label
3049,new case of covid lagos fct kaduna sokoto kebbi yobe borno edo bauchi gombe enugu oyo zamfara nasarawa osun ebonyi kwara kano plateau confirmed case of covid in nigeria discharged death,real
3050,a a patient you can take step to reduce your risk of sepsis follow these simple tip to protect yourself and your family sam,real
3051,denmark passed from new case of covid in one day to only case,fake
3052,dog cleared by who to resume eating single piece of spaghetti until they kiss coronavirus who covid,fake
3053,eldano canadiancorrup globalnews china bioengineered covid wuhan lab it wa purposefully released domestically to quell hk protest it wa allowed to travel outside of country primary target america it called asymmetric warfare lowintensity conflict covid is a primer for a colour revolution,fake
3054,in ka covid case are not spiking so mohfwindia sent only if csogok need more purchase cycle pimp i e administration,fake
3055,say a pandemic occurs exactly every year,fake
3056,russian president vladimir putin released lion and tiger across russia to devour anyone who come out stay home or die hard goat,fake
3057,indiafightscorona india record more than recovery for two day in a row total recovery cross lakh recovered case exceed active case by more than lakh staysafe indiawillwin,real
3058,a doctor who went to uttar pradesh a state in india to screen patient for coronavirus wa attacked with stone by muslim she succumbed to her injury,fake
3059,the committee will engage with all the stakeholder including state government and vaccine manufacturer pmoindia drharshvardhan ashwinikchoubey pibindia ddnewslive airnewsalerts covidnewsbymib covidindiaseva icmrdelhi nitiaayog ptinews ani,real
3060,there are case of the news coronavirus in maturín city,fake
3061,since the onset of covid 19nigeria we ve trained over health worker on infection prevention control ipc we ve developed an online course on ipc to reduce risk of covid transmission in health care setting takeresponsibility chikwei at ptfcovid,real
3062,transport sec grant shapps say it very important we dont end up in the position of france and spain whove seen a spike in covid case a he arrives at a cabinet meeting ahead of the pm announcement on new national restriction kayburley,real
3063,new case of covid lagos fct delta oyo borno river edo ebonyi anambra gombe nasarawa imo kano sokoto jigawa ogun bauchi kebbi kaduna katsina ondo abia niger case of covid discharged death,real
3064,coronavirus the number behind the uk newest covid warning,real
3065,the existence of a canine coronavirus vaccine cast doubt on statement that there isn t one for human,fake
3066,the federal government fired thousand public servant who received illegally the emergency covid allowance,fake
3067,brazilian army built hospital bed in hour,fake
3068,drdavidsamadi dr samadi do you believe covid is bioengineered,fake
3069,we will do whatever is humanly possible to protect our care home from this virus so they re a place of sanctuary this winter health secretary matt hancock announces the adult social care infection control fund will be extended get more here,real
3070,italian billionaire commits suicide by throwing himself from the 20th floor of his tower after his entire family wa wiped out by coronavirus,fake
3071,news eu threatens to expel the uk unless parliament is reopened,fake
3072,this month s blood disorder webinar will discus covid associated vte risk and consideration preregister now and join u september at p m et,real
3073,new in a recent press conference president realdonaldtrump oversold credit due the white house for a falling coronavirus fatality statistic,fake
3074,the italian government is prohibiting christian mass while it allows prayer in islamic mosque,fake
3075,joe exotic test positive for coronavirus in prison,fake
3076,a may study in the proceeding of the national academy of science show that talking can produce thousand of saliva droplet that stay in the air for up to minute,real
3077,acc to biharhealthdept till july there have been covid case in sitamarhi district of bihar of which have recovered and are active case covid covid covid coronaupdates coronavirusindia coronavirusupdates coronavirus covidupdates,real
3078,new case of covid 19nigeria fct lagos ondo osun plateau river enugu nasarawa bayelsa ebonyi ekiti oyo edo abia ogun katsina imo adamawa confirmed discharged death,real
3079,by now the five largest known cluster of the virus in the united state are not at nursing home or meatpacking plant but inside correction institution,real
3080,first death from coronavirus in barranquilla columbia,fake
3081,our covid number are better than almost all country,fake
3082,nice rapid evidence review fails to support the use of vitamin d to reduce risk or severity of covid,real
3083,respect putin daughter wa among the volunteer for trial russianvaccine russie,fake
3084,texas did not report yesterday so their number are for day they ve also changed their method of counting death to a more comprehensive but slower method read more about the complex accounting of covid death in our most recent blog post,real
3085,chicagosmayor why is jb pritzker using chinese test kit on illinoisan from a company whose gm is affiliated with the wuhan institute of virology the center of the covid controversy which ha been deemed by researcher a a bioweapon lab,fake
3086,we re not where we want to be in the response to covid 19nigeria we have reagent for about test across our lab network however our testing capacity is grossly underutilised we re challenging state to collect sample from the right people chikwei on arisetv,real
3087,a video show a man spitting inside food packet during the coronavirus crisis,fake
3088,northern ireland first minister arlene foster say new restriction are tough for a country known for our hospitality but say it is no kindness to host or attend large gathering at the moment she said adding that the only winner would be covid,real
3089,a video of nairobi governor mike sonko claiming the world health organization who recommends drinking alcohol to help prevent the new coronavirus is circulating online,fake
3090,photo show million of people at berlin anticoronavirus restriction rally in late august,fake
3091,the total number of active case in managed isolation facility in new zealand is now,real
3092,sadly we had some historical data adjustment come in right after we pulled the number for these tweet they nudged death up pushing the day average back over here what the data like now,real
3093,using infrared thermometer on the forehead to check the temperature of the body can harm the organ in the head,fake
3094,ok grade are back the score contains simple component for reporting positive reliably only nv fails for reporting negative sometimes for reporting negative reliably for reporting all commercial test all lab report positive,real
3095,while the number of covid case which are counted cumulatively are increasing other indicator used to track weekly national trend in the level of illness hospitalization rate and the proportion of death from covid fell from the prior week,real
3096,final shoutout to kansa kdhe and illinois idph thus far they are the only two state breaking out testing by race and ethnicity,real
3097,hydroxychloroqen a memory supplement donaldtrump republican coronavirus dranthonyfauci hydroxychloroquine,fake
3098,american confused a to whether getting coronavirus is good or bad coronavirus politicalcorrectness covid,fake
3099,news man planning to spend lockdown writing a novel will probably just wank himself into an early grave,fake
3100,report outbreak of idiocy spreading time faster than coronavirus coronavirus,fake
3101,a video show health worker turning their back in protest a an official car pa supposedly a if it were a protest against the minister of health of spain salvador illa or against the minister of equality irene montero at the gregorio marañón hospital,fake
3102,senegal doctor have come up with a serum against the coronavirus,fake
3103,trump said new zealand had a big surge on the day it reported nine new covid case we don t want that he said despite ten of thousand of new daily case in the u s trump s claim about a big surge rated false,fake
3104,cristiano ronaldo will transform his hotel in portugal into hospital to help in the fight against coronavirus he ha communicated that hell pay the worker doctor free,fake
3105,a viral video where an interview from the tierra pura portal is disseminated to the doctor mariana colombres garmendia who denounces the overregistration of the number of people infected and killed by the covid disease in argentina and say that the buenos aire government pay the doctor or institution for doing so for the alleged purpose of extending the quarantine,fake
3106,rt factchecknet after launching covid chatbots for whatsapp in english spanish and hindi factchecknet is proud to announce a 4th l,fake
3107,pakistani dr usman riaz speaks about coronavirus before his death,fake
3108,covid patient often report persistent symptom such a me cf making long covid this week s clinical trend,real
3109,professor chris whitty say the uk must take covid very seriously for the next six month and there no evidence the virus is currently a milder form of the one in april read more,real
3110,ok our daily update is published state reported 637k test today s case count is the secondhighest in our data the record wa set yesterday hospitalization kept moving upward and state reported death,real
3111,audio from whatsapp in which the head of cardiology at the gregorio marañón hospital state that we are in a moment of uncontrolled coronavirus infection,fake
3112,among individual state two stand out for different reason first new jersey case total jumped from to unfortunately they only report total test by their own public health lab so we dont know the true denominator for the positive,real
3113,manir hossain a yearold man from india s tripura died in a hospital in malaysia due to the new coronavirus,fake
3114,video show canadian pm wife talking about the effect of coronavirus,fake
3115,indiafightscorona state and ut have registered recovery rate more than the national average,real
3116,our daily update is published state reported 636k test 245k le than last thursday today case count is 43k and the death toll is,real
3117,alberto fernández about the coronavirus mortality in people over is,fake
3118,indiafightscorona who guideline on covid test who ha recommended sample per day per or test per day per million population detail staysafe indiawillwin,real
3119,chloroquine is an effective remedy for coronavirus,fake
3120,a positive test of such rapidantigentest should be considered a a true positive whereas all symptomatic individual testing negative through the rapid antigen test should be confirmed with a realtime pcrtest to rule out infection,real
3121,that said some state like maryland have begun to separate out confirmed and probable death this method of reporting look like the best path forward to allow for comprehensive accounting,real
3122,african glad they dont live in america coronavirus satire irony,fake
3123,social medium post shared ten of thousand of time claim white house adviser dr anthony fauci stand alone in insisting hydroxychloroquine s effectiveness against covid is unproven while italy france spain and brazil say it work,fake
3124,the uk face another national lockdown in short order unless people abide by new covid restriction a government adviser warns,real
3125,indiafightscorona india testing capacity ha surged to more than 12l daily test higher than cr total test have been conducted across the country,real
3126,homeopathic drug arsenicum album for prevention of coronavirus infection the message claim that the ayush ministry of india ha suggested taking the arsenicum album homeopathic medicine for three day to avoid infecting the coronavirus,fake
3127,when this project began we did not know wed still be doing this in april now we expect to be doing it for many more month and are putting together the technical and organizational resource to do it huge thanks to our many volunteer and our institutional home theatlantic,real
3128,today ncdc ha accredited laboratory across the country for a total capacity to test daily lagos state fct with support from ncdc have established several sample collection center national testing strategy is being reviewed to maximize testing he mbuhari,real
3129,news man tweeting alllivesmatter also advocate risking vulnerable people dying from covid to get economy going again,fake
3130,osd to maharashtra cm uddhav thackeray break down during a press meet referring to the pathetic handling of covid by the government he also head the medical assistance cell,fake
3131,indiafightscorona india ha registered the highest recovery in a single day covid patient have recovered in the last hr india s case fatality rate is below the global average stand at today detail staysafe,real
3132,a new vaccine for covid will alter a person dna and genetically modify human,fake
3133,high street across england are set to benefit from a million governmentfunded scheme to help them recover from the impact of covid chief executive of historic england duncan wilson breakfast channel watch live,real
3134,because of a who clause dutch primary school are allowed to vaccinate child without their parent consent,fake
3135,finally a indian student from pondicherry university named ramu found a home remedy cure for covid which is for the very first time accepted by who he proved that by adding tablespoon of black pepper powder to table spoon of honey and some ginger juice for consecutive day would suppress the effect of corona and eventually go away entire world is starting to accept this remedy finally a good news in please circulate this information to all your family member and friend,fake
3136,yesterday we erroneously reported one new case in ekiti this wa wrong and wa caused by an error in the verification process therefore a at april there are confirmed case discharged and death ekiti state ha confirmed case not,real
3137,our daily update is published we ve now tracked almost million test up 223k from yesterday note that we can only track test that a state report and not all state report all test for detail see,real
3138,paul manafort released from prison to home confinement amid coronavirus concern manafort,fake
3139,indiafightscorona new confirmed case have been reported in the last hour in the country of the new case are found to be concentrated in ten state ut,real
3140,dr zhong nanshan said saline solution can kill the virus,fake
3141,north carolina s health department is telling hospital that if they decide to do elective surgery they won t be eligible to receive protective equipment from the state,fake
3142,health ministry issue manual for surveillance team for containment zone pmoindia drharshvardhan ashwinikchoubey pibindia mygovindia covidindiaseva covidnewsbymib mibindia,real
3143,communicating prevention message is critical to slowing spread of covid the first step is to get to know all of the partner involved say cdc s maggie silver read about communication partnership she support a part of the covid response,real
3144,our total number of recovered case and we have only active case no additional death there is one person still in hospital and that person doe not require intensive care yesterday our lab processed test the total of test completed is now,real
3145,update coronavirus covid pandemic could disrupt bed net distribution core health service malaria burden could more than double in a a result distribution of longlasting insecticide treated net essential to mitigate risk report,real
3146,indiafightscorona india maintains trend of high recovery new recovery have exceeded new case for 5th day in a row recovery rate continues to rise cross staysafe indiawillwin,real
3147,older people those with preexisting medical condition such a diabetes cancer are at a higher risk of complication from covid let takeresponsibility by ensuring proper hand hygiene physical distancing and wearing a mask especially around vulnerable group,real
3148,people knew about coronavirus for year but this information wa hidden from ordinary people the authority just waited for the right time to launch the virus,fake
3149,continue to use preventive action like washing your hand and wearing a mask while you clean up or when returning home after hurricane sally covid,real
3150,ltc death have occurred since june even after covid s risk were established facility struggled to obtain rapid testing and personal protective equipment one health economist call the federal government s response a dismal failure,real
3151,covid test result that come a week or more later are useless,real
3152,icmr establishes new covid testing facility launched by hon pm narendramodi these lab will increase testing capacity reduce turnaroundtime reduce exposure for lab personnel drharshvardhan myyogiadityanath mamataofficial,real
3153,death yesterday were pretty close to the average april daily death of but lower than recent day note we saw a big dip sun mon last week before jumping to a new plateau,real
3154,rt mohfwindia indiafightscorona india s maintains it high covid recovery rate total recovery cross lakh recovered patient,real
3155,just in case you are wondering how much the medium control people america ha been vaccinating cattle for coronavirus for year yet the news tell you it s new and gunna kill you all so go buy mask,fake
3156,rt cdcncezid some pet in the u have tested positive for covid mostly after contact with a person with covid protect your pet,real
3157,a of today we re still not sure how much the new hhs guideline for hospital data reporting will affect the data state report so far it look like two state idaho and missouri have run into trouble here s what the mo hospital assoc had to say,real
3158,it look to u like indiana ha to be added to the list of serious outbreak it worth watching the state press conference they discus the hospitalization situation beginning around,real
3159,news man regret signing up to dating site with username covid,fake
3160,coronavirus ha made tackling obesity more urgent than ever,real
3161,quote anthony fauci a writing i reject the notion that it s just a virus and we ll all get it eventually what a careless lazy heartless stance,fake
3162,rt mohfwindia indiafightscorona india scale new height in covid testing more than lakh test conducted in the last hour,real
3163,the centre released guideline for unlock third phase in the easing of restriction put in place to curb the spread of covid this will come in to effect from august bihar government ha dispelled rumour of a statewide lockdown till august coronavirusfacts covid,fake
3164,coronavirus curfew for bar and pub among new lockdown restriction in northeast england,real
3165,the white house ha started pushing for student to return to school in the fall we consulted study and expert to get a better idea of how community can safely educate their student during covid,fake
3166,a of today karnataka recoveryrate of covid patient is mohfwindia drharshvardhan drhvoffice covid covid covid coronaupdates coronavirusindia coronavirusupdates coronavirus covidupdates,real
3167,people have recovered of our confirmed and probable case are now recovered test were processed yesterday this brings the total number of test to people are currently in hospital,real
3168,the facility is the critical mechanism for joint procurement and pooling risk across multiple vaccine so that whatever vaccine is proven to be safe and effective all country within the facility will be able to access them drtedros covid,real
3169,brahmin a higher indian caste chopped off a girl tongue a an offering to god to prevent covid infection,fake
3170,new cdc travel notice covid in australia brazil canada chile japan israel pakistan thailand and turkey avoid all nonessential travel to these area more information,real
3171,the cdc covidview report summarizes new data on covid like illness hospitalization rate and death associated with influenza pneumonia or covid,real
3172,the pandemic is a fake excuse for bill gate to depopulate the earth,fake
3173,new case of covid 19nigeria lagos gombe oyo delta ondo plateau ebonyi fct kwara kaduna river ogun anambra imo ekiti confirmed discharged death,real
3174,a johnson johnson covid vaccine trial prevented severe illness in a small group of hamster however the promising result in hamster doe not necessarily mean the vaccine will provide the same level of protection in human read more by cnbc,real
3175,coronavirusupdates indiafightscorona india s total covid recovered case are now double the active case pmoindia drharshvardhan ashwinikchoubey pibindia ddnewslive airnewsalerts icmrdelhi mygovindia covidnewsbymib covidindiaseva,real
3176,not only daily corona case ha been d highest in d world since august today our govt transformed corona india recorded another grime milestone by overtaking brazil now indian tax payer urge performance expert minister only carry out u frm dis,fake
3177,u surpasses record new case of coronavirus,fake
3178,johnkubie joshtpm were looking at county right now through a collaboration with an existing group alexismadrigal,real
3179,bit of a surprising day fewer test and positive than expected for a tuesday only 18k case reported today which substantially brought down the day average case getting to very low level in new england and midatlantic state,real
3180,donald trump will always put his wealthy and wellconnected friend first that should come a no surprise but to allow the bank to do it on the back of small business owner in the middle of a global pandemic is a new low even for him,fake
3181,rt cdcdirector i have confidence that the american public will continue to embrace covid mitigation technique face mask social dist,real
3182,who call for isolation of china due to the coronavirus,fake
3183,there are icmrdelhi approved covid testing lab in delhi comprising govt lab pvt lab kindly refer to the following link for the list of lab covid covid covid covid covid 19india corona coronavirus coronavirusindia,real
3184,everyone should stock up essential such a milk ration medicine and cash a india is soon going to declare national emergency,fake
3185,ancient herbal drink is an effective remedy for the novel coronavirus,fake
3186,image and statement from the prime minister of italy,fake
3187,a of today district with highest no of active covid case in gujarat are surat ahmedabad vadodara rajkot mehsana covid covid covid coronaupdates coronavirusindia coronavirusupdates coronavirus covidupdates,real
3188,coronavirustruth exclusive china is tracking every movement of it uighur minority to find reason to detain them a leaked document ppl have been arrested for growing beard or having too many child karakaxlist,fake
3189,prime minister boris johnson say the uk doe not currently have the testing capacity available to meet the demand of people wanting covid test but add the daily testing capacity will be by the end of october follow live,real
3190,massive thanks to all the state employee who are updating their public health site under difficult circumstance we huddled a a team and put together some suggestion on how covid test data reporting could be improved to make aggregation easier,real
3191,message from health authority chandigarh hello i kindly request you not to come out of your house after pm tonight till tomorrow am a their will be spraying medicine in the air in order to kill the covid share this information to all your friend relative and your family for chandigarh thank you,fake
3192,coronavirus in which country of the world patient treated like prisoner,fake
3193,also note expert say that broad testing will not be the optimal strategy for all stage of all local outbreak but and over the long term testing remains an important strategy for understanding and resolving this crisis,real
3194,a video ha been viewed hundred of thousand of time in post on facebook twitter and youtube that claim it show a freight train carrying essential commodity for those in covid lockdown in india,fake
3195,lbgoodnessgrows jamesdsteinberg rapidtests stevefda cdcdirector hhsash aslavitt ashishkjha jhuber ctbergstrom paulmromer mcuban michaelminalab drtomfrieden ranudhillon carlosdelrio ltgrusselhonore blame chyna for this lab manufactured disease and democrat for funding the wuhan lab and sham impeachment while this kung flu wa being secretly imported from chyna while their domestic transportation wa under lockdown criticize trump for flight ban from chyna now,fake
3196,news hope on the horizon a white house announces major breakthrough in search for covid scapegoat,fake
3197,jared leto creating a cult to save people from the coronavirus,fake
3198,a video show a mock funeral procession to celebrate indian home minister amit shah testing positive for the novel coronavirus,fake
3199,a video viewed more than million time on facebook urge people to inhale steam to kill the novel coronavirus,fake
3200,if you re sick with covid your pet becomes sick don t take your pet to the veterinary clinic yourself call your veterinarian let them know you have been sick with covid,real
3201,u s house speaker nancy pelosi wa in wuhan china six day after the impeachment proceeding against president trump ended,fake
3202,pcr test cannot detect a new coronavirus,fake
3203,a on sep the fatalityrate for covid case across india is covid covid covid covid covid 19india corona coronavirus coronavirusindia coronaviruspandemic coronavirusupdates covidupdates coronaupdate coronaupdatesindia,real
3204,coronavirus wetherspoons reveals staff have caught covid since pub reopened,real
